Source.Name,sent,point_id,point_text,match_score,point_title,flag
match_985.csv,Advertisements: You may see our Service advertised in other applications or websites.,,"Advertisements: You may see our Service advertised in other applications or websites. After clicking on one of these advertisements and installing our Service, you will become a user of the Service. Advertising platforms, which include Twitter and Facebook (and whose SDKs are integrated within our Service), may collect information for optimizing advertising campaigns outside of the Service. ",100,,"Many sentences match for point 11454
"
match_985.csv,"After clicking on one of these advertisements and installing our Service, you will become a user of the Service.",,"Advertisements: You may see our Service advertised in other applications or websites. After clicking on one of these advertisements and installing our Service, you will become a user of the Service. Advertising platforms, which include Twitter and Facebook (and whose SDKs are integrated within our Service), may collect information for optimizing advertising campaigns outside of the Service. ",100,,"Many sentences match for point 11454
"
match_985.csv,"Advertising platforms, which include Twitter and Facebook (and whose SDKs are integrated within our Service), may collect information for optimizing advertising campaigns outside of the Service.",,"Advertisements: You may see our Service advertised in other applications or websites. After clicking on one of these advertisements and installing our Service, you will become a user of the Service. Advertising platforms, which include Twitter and Facebook (and whose SDKs are integrated within our Service), may collect information for optimizing advertising campaigns outside of the Service. ",100,,"Many sentences match for point 11454
"
match_985.csv,"If you provide information for a certain reason, we may use the information in connection with the reason for which it was provided.",,"OUR USE OF YOUR INFORMATIONWe use the information you provide in a manner that is consistent with this Privacy Policy. If you provide information for a certain reason, we may use the information in connection with the reason for which it was provided. For instance, if you contact us by email, we will use the information you provide to answer your question or resolve your problem. Also, if you provide information in order to obtain access to the Services, we will use your information to provide you with access to such services and to monitor your use of such services.",100,,"Many sentences match for point 11456
"
match_985.csv,"For instance, if you contact us by email, we will use the information you provide to answer your question or resolve your problem.",,"OUR USE OF YOUR INFORMATIONWe use the information you provide in a manner that is consistent with this Privacy Policy. If you provide information for a certain reason, we may use the information in connection with the reason for which it was provided. For instance, if you contact us by email, we will use the information you provide to answer your question or resolve your problem. Also, if you provide information in order to obtain access to the Services, we will use your information to provide you with access to such services and to monitor your use of such services.",100,,"Many sentences match for point 11456
"
match_985.csv,"Also, if you provide information in order to obtain access to the Services, we will use your information to provide you with access to such services and to monitor your use of such services.",,"OUR USE OF YOUR INFORMATIONWe use the information you provide in a manner that is consistent with this Privacy Policy. If you provide information for a certain reason, we may use the information in connection with the reason for which it was provided. For instance, if you contact us by email, we will use the information you provide to answer your question or resolve your problem. Also, if you provide information in order to obtain access to the Services, we will use your information to provide you with access to such services and to monitor your use of such services.",100,,"Many sentences match for point 11456
"
match_985.csv,"The Company and its subsidiaries and affiliates (the “Related Companies”) may also use your information collected through the Services to help us improve the content and functionality of the Services, to better understand our users and to improve the Services.",11457,"The Company and its subsidiaries and affiliates (the “Related Companies”) may also use your information collected through the Services to help us improve the content and functionality of the Services, to better understand our users and to improve the Services.
The Company and its affiliates may use this information to contact you in the future to tell you about services we believe will be of interest to you.
If we do so, each marketing communication we send you will contain instructions permitting you to ""opt-out"" of receiving future marketing communications.
In addition, if at any time you wish not to receive any future marketing communications or you wish to have your name deleted from our mailing lists, please contact us as indicated below.",100,,"Many sentences match for point 11457
"
match_985.csv,The Company and its affiliates may use this information to contact you in the future to tell you about services we believe will be of interest to you.,11457,"The Company and its subsidiaries and affiliates (the “Related Companies”) may also use your information collected through the Services to help us improve the content and functionality of the Services, to better understand our users and to improve the Services.
The Company and its affiliates may use this information to contact you in the future to tell you about services we believe will be of interest to you.
If we do so, each marketing communication we send you will contain instructions permitting you to ""opt-out"" of receiving future marketing communications.
In addition, if at any time you wish not to receive any future marketing communications or you wish to have your name deleted from our mailing lists, please contact us as indicated below.",100,,"Many sentences match for point 11457
"
match_985.csv,The Services may contain links to other web sites not operated or controlled by us (the “Third Party Sites”).,11461,"The Services may contain links to other web sites not operated or controlled by us (the “Third Party Sites”).
The policies and procedures we described here do not apply to the Third Party Sites.
The links from the Services do not imply that we endorse or have reviewed the Third Party Sites.

        ",100,,"Many sentences match for point 11461
"
match_985.csv,The policies and procedures we described here do not apply to the Third Party Sites.,,"The Services may contain links to other web sites not operated or controlled by us (the “Third Party Sites”).
The policies and procedures we described here do not apply to the Third Party Sites.
The links from the Services do not imply that we endorse or have reviewed the Third Party Sites.

        ",100,,"Many sentences match for point 11461
"
match_985.csv,The links from the Services do not imply that we endorse or have reviewed the Third Party Sites.,,"The Services may contain links to other web sites not operated or controlled by us (the “Third Party Sites”).
The policies and procedures we described here do not apply to the Third Party Sites.
The links from the Services do not imply that we endorse or have reviewed the Third Party Sites.

        ",100,,"Many sentences match for point 11461
"
match_985.csv,How do I object or restrict the manner in which Discord processes my personal data?,11467,"How do I object or restrict the manner in which Discord processes my personal data? You have a right to ask us to stop using or limit our use of your personal data in certain circumstances—for example, if we have no lawful basis to keep using your data, or if you think your personal data is inaccurate. Discord offers you the ability to restrict the processing of your data for specific uses, which you can find in the “Settings” page of the services. Individuals in the European Economic Area have the right to opt out of all of our processing of their personal data for direct marketing purposes. To exercise this right, please see the “Settings” page for your Account. You may also click the “unsubscribe” link in any of our marketing emails. The rights and options described above are subject to limitations and exceptions under applicable law. In addition to those rights, you have the right to lodge a complaint with the relevant supervisory authority. However, we encourage you to contact us first, and we will do our very best to resolve your concern.",100,,"Many sentences match for point 11467
"
match_985.csv,"You have a right to ask us to stop using or limit our use of your personal data in certain circumstances—for example, if we have no lawful basis to keep using your data, or if you think your personal data is inaccurate.",11467,"How do I object or restrict the manner in which Discord processes my personal data? You have a right to ask us to stop using or limit our use of your personal data in certain circumstances—for example, if we have no lawful basis to keep using your data, or if you think your personal data is inaccurate. Discord offers you the ability to restrict the processing of your data for specific uses, which you can find in the “Settings” page of the services. Individuals in the European Economic Area have the right to opt out of all of our processing of their personal data for direct marketing purposes. To exercise this right, please see the “Settings” page for your Account. You may also click the “unsubscribe” link in any of our marketing emails. The rights and options described above are subject to limitations and exceptions under applicable law. In addition to those rights, you have the right to lodge a complaint with the relevant supervisory authority. However, we encourage you to contact us first, and we will do our very best to resolve your concern.",100,,"Many sentences match for point 11467
"
match_985.csv,"Discord offers you the ability to restrict the processing of your data for specific uses, which you can find in the “Settings” page of the services.",11467,"How do I object or restrict the manner in which Discord processes my personal data? You have a right to ask us to stop using or limit our use of your personal data in certain circumstances—for example, if we have no lawful basis to keep using your data, or if you think your personal data is inaccurate. Discord offers you the ability to restrict the processing of your data for specific uses, which you can find in the “Settings” page of the services. Individuals in the European Economic Area have the right to opt out of all of our processing of their personal data for direct marketing purposes. To exercise this right, please see the “Settings” page for your Account. You may also click the “unsubscribe” link in any of our marketing emails. The rights and options described above are subject to limitations and exceptions under applicable law. In addition to those rights, you have the right to lodge a complaint with the relevant supervisory authority. However, we encourage you to contact us first, and we will do our very best to resolve your concern.",100,,"Many sentences match for point 11467
"
match_985.csv,Individuals in the European Economic Area have the right to opt out of all of our processing of their personal data for direct marketing purposes.,11467,"How do I object or restrict the manner in which Discord processes my personal data? You have a right to ask us to stop using or limit our use of your personal data in certain circumstances—for example, if we have no lawful basis to keep using your data, or if you think your personal data is inaccurate. Discord offers you the ability to restrict the processing of your data for specific uses, which you can find in the “Settings” page of the services. Individuals in the European Economic Area have the right to opt out of all of our processing of their personal data for direct marketing purposes. To exercise this right, please see the “Settings” page for your Account. You may also click the “unsubscribe” link in any of our marketing emails. The rights and options described above are subject to limitations and exceptions under applicable law. In addition to those rights, you have the right to lodge a complaint with the relevant supervisory authority. However, we encourage you to contact us first, and we will do our very best to resolve your concern.",100,,"Many sentences match for point 11467
"
match_985.csv,"To exercise this right, please see the “Settings” page for your Account.",,"How do I object or restrict the manner in which Discord processes my personal data? You have a right to ask us to stop using or limit our use of your personal data in certain circumstances—for example, if we have no lawful basis to keep using your data, or if you think your personal data is inaccurate. Discord offers you the ability to restrict the processing of your data for specific uses, which you can find in the “Settings” page of the services. Individuals in the European Economic Area have the right to opt out of all of our processing of their personal data for direct marketing purposes. To exercise this right, please see the “Settings” page for your Account. You may also click the “unsubscribe” link in any of our marketing emails. The rights and options described above are subject to limitations and exceptions under applicable law. In addition to those rights, you have the right to lodge a complaint with the relevant supervisory authority. However, we encourage you to contact us first, and we will do our very best to resolve your concern.",100,,"Many sentences match for point 11467
"
match_985.csv,You may also click the “unsubscribe” link in any of our marketing emails.,,"How do I object or restrict the manner in which Discord processes my personal data? You have a right to ask us to stop using or limit our use of your personal data in certain circumstances—for example, if we have no lawful basis to keep using your data, or if you think your personal data is inaccurate. Discord offers you the ability to restrict the processing of your data for specific uses, which you can find in the “Settings” page of the services. Individuals in the European Economic Area have the right to opt out of all of our processing of their personal data for direct marketing purposes. To exercise this right, please see the “Settings” page for your Account. You may also click the “unsubscribe” link in any of our marketing emails. The rights and options described above are subject to limitations and exceptions under applicable law. In addition to those rights, you have the right to lodge a complaint with the relevant supervisory authority. However, we encourage you to contact us first, and we will do our very best to resolve your concern.",100,,"Many sentences match for point 11467
"
match_985.csv,The rights and options described above are subject to limitations and exceptions under applicable law.,11467,"How do I object or restrict the manner in which Discord processes my personal data? You have a right to ask us to stop using or limit our use of your personal data in certain circumstances—for example, if we have no lawful basis to keep using your data, or if you think your personal data is inaccurate. Discord offers you the ability to restrict the processing of your data for specific uses, which you can find in the “Settings” page of the services. Individuals in the European Economic Area have the right to opt out of all of our processing of their personal data for direct marketing purposes. To exercise this right, please see the “Settings” page for your Account. You may also click the “unsubscribe” link in any of our marketing emails. The rights and options described above are subject to limitations and exceptions under applicable law. In addition to those rights, you have the right to lodge a complaint with the relevant supervisory authority. However, we encourage you to contact us first, and we will do our very best to resolve your concern.",100,,"Many sentences match for point 11467
"
match_985.csv,"In addition to those rights, you have the right to lodge a complaint with the relevant supervisory authority.",,"How do I object or restrict the manner in which Discord processes my personal data? You have a right to ask us to stop using or limit our use of your personal data in certain circumstances—for example, if we have no lawful basis to keep using your data, or if you think your personal data is inaccurate. Discord offers you the ability to restrict the processing of your data for specific uses, which you can find in the “Settings” page of the services. Individuals in the European Economic Area have the right to opt out of all of our processing of their personal data for direct marketing purposes. To exercise this right, please see the “Settings” page for your Account. You may also click the “unsubscribe” link in any of our marketing emails. The rights and options described above are subject to limitations and exceptions under applicable law. In addition to those rights, you have the right to lodge a complaint with the relevant supervisory authority. However, we encourage you to contact us first, and we will do our very best to resolve your concern.",100,,"Many sentences match for point 11467
"
match_985.csv,"However, you can disable cookies by changing your browser settings.",6120,"However, you can disable cookies by changing your browser settings.
Further information about the procedure to follow in order to disable cookies can be found on your Internet browser provider's website via your help screen.
        ",100,,"Many sentences match for point 6120
"
match_985.csv,Further information about the procedure to follow in order to disable cookies can be found on your Internet browser provider's website via your help screen.,6120,"However, you can disable cookies by changing your browser settings.
Further information about the procedure to follow in order to disable cookies can be found on your Internet browser provider's website via your help screen.
        ",100,,"Many sentences match for point 6120
"
