Source.Name,sent,point_id,point_text,match_score,point_title,flag
match_158.csv,How this statement changes over time We’ll make changes to this privacy statement from time to time.,,,,,
match_158.csv,This helps us stay up to date with changes to our business and the most current laws.,12643,"We’ll make changes to this privacy statement from time to time.
This helps us stay up to date with changes to our business and the most current laws.
        ",100,,
match_158.csv,"After a new version is published, we’ll collect, store, use, and protect your personal data as we outline in that revised statement.",,,,,
match_158.csv,"If the new version reduces your rights or increases your responsibilities, we’ll post it on the Policy Updates or Privacy Statement page of our website at least 21 days before it becomes effective.",,,,,
match_158.csv,We may notify you about these changes through email or other communications.,,,,,
match_158.csv,"Contact Us If you have questions about this privacy statement or your personal data, contact us so we can help.",,,,,
match_158.csv,"To talk about your PayPal account:  Call PayPal Customer Service at 1-888-221-1161 or visit our Customer Service web portal   To talk about your Xoom account:  Call Xoom Customer Service at 1-877-815-1531 or visit our Help Center web portal     Consumer Privacy Notice   Effective Date: March 12, 2020 This Consumer Privacy Notice applies to you if you are an individual who resides in the United States and uses PayPal sites or services for your own personal, family or household purposes.",,,,,
match_158.csv,FACTS  WHAT DOES PAYPAL DO WITH YOUR PERSONAL INFORMATION?,12645,WHAT DOES PAYPAL DO WITH YOUR PERSONAL INFORMATION?   Why?,94,Information is provided about how your personal data is used,
match_158.csv,"Federal law also requires us to tell you how we collect, share, and protect your personal information.",,,,,
match_158.csv,Please read this notice carefully to understand what we do.,,,,,
match_158.csv,The types of personal information we collect and share depend on the product or service you have with us.,,,,,
match_158.csv,"This information can include:  Social Security number and account balances Payment history or transaction history Credit history or credit scores  When you are no longer our customer, we continue to share your information as described in this notice.",12646,"When you are no longer our customer, we continue to share your information as described in this notice.",100,,
match_158.csv,All financial companies need to share customers’ personal information to run their everyday business.,,,,,
match_158.csv,"In the section below, we list the reasons financial companies can share their customers’ personal information.",,,,,
match_158.csv,the reasons PayPal chooses to share.,,,,,
match_158.csv,and whether you can limit this sharing.,,,,,
match_158.csv,Reasons we can share your personal information Does PayPal share?,,,,,
match_158.csv,Can you limit this sharing?,,,,,
match_158.csv,"For our everyday business purposes –  such as to process your transactions, maintain your account(s), respond to court orders and legal investigations, or report to credit bureaus Yes No  For our marketing purposes –  to offer our products and services to you Yes No    For joint marketing with other financial companies  Yes No  For our affiliates’ everyday business purposes –  information about your transactions and experiences Yes No  For our affiliates’ everyday business purposes –  information about your creditworthiness No We don’t share  For our affiliates to market to you  No We don’t share  For nonaffiliates to market to you  No We don’t share Questions?",,,,,
match_158.csv,Call our customer service at 1-888-221-1161or visit us at https://www.paypal.com/us/smarthelp/contact-us?email=privacy.,,,,,
match_158.csv,Who we are  Who is providing this Privacy Statement?,,,,,
match_158.csv,"This privacy notice is provided by PayPal, Inc. and is applicable to your personal U.S. PayPal and/or Xoom accounts.",,,,,
match_158.csv,What we do  How does PayPal protect my personal information?,,,,,
match_158.csv,"To protect your personal information from unauthorized access and use, we use security measures that comply with federal law.",,,,,
match_158.csv,These measures include computer safeguards and secured files and buildings.,,,,,
match_158.csv,Why can’t I limit all sharing?,,,,,
match_158.csv,Federal law gives you the right to limit only  sharing for affiliates’ everyday business purposes — information about your creditworthiness affiliates from using your information to market to you sharing for nonaffiliates to market to you  State laws and individual companies may give you additional rights to limit sharing.,,,,,
match_158.csv,See below for more information on your rights under state law.,,,,,
match_158.csv,Definitions  Affiliates  Companies related by common ownership or control.,,,,,
match_158.csv,They can be financial and nonfinancial companies.,,,,,
match_158.csv,"Our affiliates include Bill Me Later, Inc.   Nonaffiliates  Companies not related by common ownership or control.",,,,,
match_158.csv,They can be financial and nonfinancial companies.,,,,,
match_158.csv,Nonaffiliates with which we share personal information include service providers that perform services or functions on our behalf.,,,,,
match_158.csv,Joint Marketing  A formal agreement between nonaffiliated financial companies that together market financial products or services to you.,,,,,
match_158.csv,"Our joint marketing partners include financial companies and banks, such as Synchrony Bank.",,,,,
match_158.csv,"Other important information We may transfer personal information to other countries, for example, for customer service or to process transactions.",,,,,
match_158.csv,"California: Effective January 1, 2020, the California Consumer Act of 2018 (CCPA) permits consumers who are California residents to ask businesses covered under the act about personal data it has collected about the consumer, submit an access or deletion request, and opt-out of the sale of personal information, if applicable.",12654,"the California Consumer Act of 2018 (CCPA) permits consumers who are California residents to ask businesses covered under the act about personal data it has collected about the consumer, submit an access or deletion request, and opt-out of the sale of personal information, if applicable.
        ",98,Your Personal data may be sold unless you opt out,
match_158.csv,"These provisions do not apply to personal data collected, processed, shared, or disclosed by financial institutions pursuant to federal law such as the Gramm-Leach-Bliley Act.",,,,,
match_158.csv,"Contact us if you have questions about our privacy statement, this consumer notice, or your personal data.",,,,,
match_158.csv,"If your PayPal account has a California mailing address, we will not share personal information we collect about you except to the extent permitted under California law.",,,,,
match_158.csv,"To talk about your PayPal account, call PayPal Customer Service at 1-888-221-1161 or visit our Customer Service web portal.",,,,,
match_158.csv,"To talk about your Xoom account, call Xoom Customer Service at 1-877-815-1531 or visit our Help Center web portal.",,,,,
match_158.csv,"Vermont: If your PayPal account has a Vermont mailing address, we will not share personal information we collect about you with non-affiliates unless the law allows or you provide authorization.",,,,,
match_158.csv,"Nevada: If your PayPal account has a Nevada mailing address, we are providing this notice pursuant to Nevada law.",,,,,
match_158.csv,"If you prefer not to receive marketing calls from PayPal, you may be placed on our internal Do Not Call List by calling 1-888-221-1161 or going to https://www.paypal.com/selfhelp/home.",,,,,
match_158.csv,"For more information, you can contact PayPal at 12312 Port Grace Blvd, La Vista, NE 68128 or you can contact the Bureau of Consumer Protection, Office of the Nevada Attorney General, 555 E. Washington St., Suite 3900, Las Vegas, NV 89101. telephone number: 1-702-486-3132. email: Aginfo@ag.nv.gov",,,,,
